Assumption / Setting;Values;Explanation;Comment
low_temp_heat_available_at_ports;True / False;Indicates if low-temperature heat is available at ports;"Affects conversion costs; value defined in cost_type"
mid_temp_heat_available_at_ports;True / False;Indicates if medium-temperature heat is available at ports;"Affects conversion costs; value defined in cost_type"
high_temp_heat_available_at_ports;True / False;Indicates if high-temperature heat is available at ports;"Affects conversion costs; value defined in cost_type"
low_temp_heat_available_at_pipelines;True / False;Indicates if low-temperature heat is available at pipelines;"Affects conversion costs; value defined in cost_type"
mid_temp_heat_available_at_pipelines;True / False;Indicates if medium-temperature heat is available at pipelines;"Affects conversion costs; value defined in cost_type"
high_temp_heat_available_at_pipelines;True / False;Indicates if high-temperature heat is available at pipelines;"Affects conversion costs; value defined in cost_type"
minimal_distance_between_pipeline_connection_points;integer;In meters. Maximum spacing between generated pipeline access points;May be overwritten by the minimal example
gap_distance;integer;In meters. If two pipeline networks are closer than this threshold, they are connected during preprocessing;Used to bridge small topology gaps in the raw data
